{
  "acceptance_commands": [
    {
      "argv": ["python3", "tools/repository/repository_tooling.py", "--root", ".", "validate-plan", "docs/evidence/M0-014/test-plan.md", "--json"],
      "gate": "task",
      "id": "test-plan-matrix",
      "long_running": false,
      "timeout_seconds": 30
    },
    {
      "argv": ["python3", "-m", "unittest", "tools.gates.tests.test_m0_014_windows_copy_profile", "-v"],
      "gate": "task",
      "id": "strict-report-validator",
      "long_running": false,
      "timeout_seconds": 60
    }
  ],
  "allowed_paths": [
    ".github/workflows/m0-014-windows-copy-profile.yml",
    "docs/evidence/M0-014",
    "docs/planning/status.md",
    "scripts/gate-m0-014-windows-copy-profile",
    "tools/gates/m0_014_windows_copy_profile.py",
    "tools/gates/native/m0_014_copy_counter.c",
    "tools/gates/tests/test_m0_014_windows_copy_profile.py",
    "tools/tasks/M0-014.json"
  ],
  "dependencies": ["M0-005"],
  "long_running_gate": false,
  "platforms": ["windows-x86_64"],
  "required_evidence": [
    "docs/evidence/M0-014/evidence.json",
    "docs/evidence/M0-014/windows-x86_64/result.json"
  ],
  "schema_version": 1,
  "source_paths": [
    ".github/workflows/m0-014-windows-copy-profile.yml",
    "docs/evidence/M0-014/README.md",
    "docs/evidence/M0-014/test-plan.md",
    "scripts/gate-m0-014-windows-copy-profile",
    "tools/gates/m0_014_windows_copy_profile.py",
    "tools/gates/native/m0_014_copy_counter.c",
    "tools/gates/tests/test_m0_014_windows_copy_profile.py",
    "tools/tasks/M0-014.json"
  ],
  "task_id": "M0-014",
  "timeout_seconds": 1800
}
