{
  "schema_version": 1,
  "task_id": "M12-003",
  "dependencies": ["M9-001"],
  "allowed_paths": ["examples/linux/m12_003", "tools/gates/m12_003_resources.py", "tools/gates/m12_003_network.py", "tools/gates/m12_003_lifecycle.py", "tools/gates/m12_003_supervision.py", "tools/gates/m12_003_campaign.py", "tools/gates/tests/test_m12_003_resources.py", "tools/gates/tests/test_m12_003_network.py", "tools/gates/tests/test_m12_003_lifecycle.py", "tools/gates/tests/test_m12_003_supervision.py", "tools/gates/tests/test_m12_003_campaign.py", "tools/gates/campaigns/m12-003-linux-faults.json", "tools/tasks/M12-003.json", "docs/guides/linux-resource-fault-profiles.md", "docs/guides/linux-network-fault-profiles.md", "docs/guides/linux-lifecycle-fault-profiles.md", "docs/guides/linux-resilience-campaign.md", "docs/evidence/M12-003", "docs/planning/status.md"],
  "platforms": ["linux-x86_64-glibc"],
  "acceptance_commands": [
    {"id": "architecture-guard", "argv": ["python3", "tools/architecture_guard.py", "--root", ".", "--format", "text"], "timeout_seconds": 60, "long_running": false, "gate": "fast"},
    {"id": "current-public-api", "argv": ["scripts/check-m7-032-public-api", "--json"], "timeout_seconds": 60, "long_running": false, "gate": "fast"},
    {"id": "fault-contracts", "argv": ["python3", "-m", "unittest", "tools.gates.tests.test_m12_003_resources", "tools.gates.tests.test_m12_003_network", "tools.gates.tests.test_m12_003_lifecycle", "tools.gates.tests.test_m12_003_supervision", "tools.gates.tests.test_m12_003_campaign", "-v"], "timeout_seconds": 120, "long_running": false, "gate": "task"},
    {"id": "bound-native-fault-evidence", "argv": ["python3", "tools/gates/m12_003_campaign.py", "verify"], "timeout_seconds": 180, "long_running": false, "gate": "task"}
  ],
  "required_evidence": ["docs/evidence/M12-003/workspace.json", "docs/evidence/M12-003/acceptance.json", "docs/evidence/M12-003/verification.json", "docs/evidence/M12-003/resources/final/report.json", "docs/evidence/M12-003/network/native-guest/current/report.json", "docs/evidence/M12-003/network/native-guest/stress-12004/report.json", "docs/evidence/M12-003/network/native-guest/stress-12005/report.json", "docs/evidence/M12-003/network/native-guest/provenance.json", "docs/evidence/M12-003/network/native-guest/cleanup.json", "docs/evidence/M12-003/network/native-guest/unit-tests.log", "docs/evidence/M12-003/lifecycle/current-stress/report.json", "docs/evidence/M12-003/supervision/sts-smoke.json", "docs/evidence/M12-003/unit-tests.log", "docs/evidence/M12-003/report.md"],
  "timeout_seconds": 420,
  "long_running_gate": false,
  "source_paths": ["examples/linux/m12_003/resources/main.cj", "examples/linux/m12_003/resources/faults.c", "examples/linux/m12_003/resources/profile.py", "examples/linux/m12_003/network/cjpm.toml", "examples/linux/m12_003/network/src/main.cj", "examples/linux/m12_003/lifecycle/common.cj", "examples/linux/m12_003/lifecycle/protocol.cj", "examples/linux/m12_003/lifecycle/race.cj", "examples/linux/m12_003/lifecycle/streams.cj", "examples/linux/m12_003/lifecycle/gzip.cj", "tools/gates/m12_003_resources.py", "tools/gates/m12_003_network.py", "tools/gates/m12_003_lifecycle.py", "tools/gates/m12_003_supervision.py", "tools/gates/m12_003_campaign.py", "tools/gates/tests/test_m12_003_resources.py", "tools/gates/tests/test_m12_003_network.py", "tools/gates/tests/test_m12_003_lifecycle.py", "tools/gates/tests/test_m12_003_supervision.py", "tools/gates/tests/test_m12_003_campaign.py", "tools/gates/campaigns/m12-003-linux-faults.json", "tools/tasks/M12-003.json", "docs/guides/linux-resource-fault-profiles.md", "docs/guides/linux-network-fault-profiles.md", "docs/guides/linux-lifecycle-fault-profiles.md", "docs/guides/linux-resilience-campaign.md"]
}
